<?xml version="1.0" encoding="UTF-8"?>
<!DOCTYPE festival SYSTEM "festival.dtd">
<festival>
    <nombre>Festival Tech del Futuro</nombre>
    <ciudad>Gijón</ciudad>
    <fecha>2026-06-15</fecha>
    <lugar>Palacio de Congresos de Gijón — Av. de la Costa, 33</lugar>
    <map>https://maps.google.com/?q=Palacio+de+Congresos+Gijon</map>
    <descripcion>El Festival Tech del Futuro es el evento tecnológico para jóvenes más importante del norte de España. Durante un día completo exploramos robótica, videojuegos, inteligencia artificial, realidad virtual y talleres de programación. Ven y descubre las tecnologías que están transformando el mundo.</descripcion>
    <actividades>
        <actividad id="a1" tipo="robotica">
            <titulo>Batalla de Robots</titulo>
            <descripcion>Competición de robots diseñados y programados por estudiantes. Los equipos se enfrentan en un torneo por eliminar al rival con sus creaciones. Aprenderás electrónica, mecánica y lógica de control mientras te diviertes.</descripcion>
            <sala>Sala Dragón — Planta Baja</sala>
            <horario>10:00 – 12:00</horario>
            <precio>Gratis</precio>
            <imagen>img/robotica.svg</imagen>
        </actividad>
        <actividad id="a2" tipo="videojuegos">
            <titulo>Torneo Gaming Retro &amp; Next-Gen</titulo>
            <descripcion>Competición multijugador que mezcla clásicos de los 80-90 con los títulos más punteros del año. Categorías para todas las edades y niveles. Premios para los tres primeros clasificados de cada categoría.</descripcion>
            <sala>Sala Píxel — Primera Planta</sala>
            <horario>12:00 – 14:00</horario>
            <precio>3 €</precio>
            <imagen>img/videojuegos.svg</imagen>
        </actividad>
        <actividad id="a3" tipo="ia">
            <titulo>Taller de Inteligencia Artificial</titulo>
            <descripcion>Crea tu propio chatbot paso a paso. Aprenderás qué es el machine learning, cómo se entrena un modelo y cómo integrarlo en una aplicación web. No se necesitan conocimientos previos de programación.</descripcion>
            <sala>Sala Neurona — Primera Planta</sala>
            <horario>14:00 – 16:00</horario>
            <precio>5 €</precio>
            <imagen>img/ia.svg</imagen>
        </actividad>
        <actividad id="a4" tipo="realidad_virtual">
            <titulo>Experiencia Realidad Virtual</titulo>
            <descripcion>Sumérgete en mundos virtuales con las últimas gafas de VR. Explora entornos inmersivos, prueba videojuegos en 360° y descubre cómo la RV se aplica en medicina, arquitectura y educación. Sesiones de 20 minutos.</descripcion>
            <sala>Sala Matrix — Segunda Planta</sala>
            <horario>16:00 – 18:00</horario>
            <precio>5 €</precio>
            <imagen>img/vr.svg</imagen>
        </actividad>
        <actividad id="a5" tipo="programacion">
            <titulo>Taller de Programación Web</titulo>
            <descripcion>Construye tu primera página web desde cero usando HTML, CSS y JavaScript. Al finalizar el taller cada participante se llevará su propio proyecto publicado en línea. Material y portátiles proporcionados por la organización.</descripcion>
            <sala>Sala Código — Segunda Planta</sala>
            <horario>18:00 – 20:00</horario>
            <precio>Gratis</precio>
            <imagen>img/programacion.svg</imagen>
        </actividad>
    </actividades>
    <contacto>
        <telefono>985 123 456</telefono>
        <whatsapp>600 123 456</whatsapp>
        <email>info@festivaltechdelfuturo.com</email>
    </contacto>
</festival>
